{
  "$schema": "https://json-schema.org/draft/2020-12/schema",
  "title": "CareerGraph",
  "type": "object",
  "properties": {
    "profile": { "type": "object" },
    "experiences": { "type": "array", "items": { "type": "object" } },
    "evidence": { "type": "array", "items": { "type": "object" } },
    "skills": { "type": "array", "items": { "type": "object" } },
    "claims": { "type": "array", "items": { "type": "object" } }
  }
}
